{"$schema":"../../../../schemas/animation-profile.schema.json","id":"koalapet.base:cinder_moth_animation","preview":"assets/vertical_slice/enemies/cinder_moth/preview.png","portrait":"assets/vertical_slice/enemies/cinder_moth/portrait.png","world_animations":{"idle":{"asset":"assets/vertical_slice/enemies/cinder_moth/idle.png","frames":1,"fps":2},"attack":{"asset":"assets/vertical_slice/enemies/cinder_moth/attack.png","frames":1,"fps":5},"hit":{"asset":"assets/vertical_slice/enemies/cinder_moth/hit.png","frames":1,"fps":5},"victory":{"asset":"assets/vertical_slice/enemies/cinder_moth/victory.png","frames":1,"fps":4},"injured":{"asset":"assets/vertical_slice/enemies/cinder_moth/injured.png","frames":1,"fps":2}}}
