{
  "$schema": "../../../../schemas/animation-profile.schema.json",
  "id": "example.neutral:meadow_animation",
  "preview": "assets/placeholders/meadow-preview.png",
  "portrait": "assets/placeholders/meadow-portrait.png",
  "world_animations": {
    "idle": {"asset": "assets/placeholders/meadow-idle.png", "frames": 4, "fps": 4, "loop": true},
    "walk": {"asset": "assets/placeholders/meadow-walk.png", "frames": 6, "fps": 8, "loop": true}
  }
}
