{
  "$schema": "../../../../schemas/animation-profile.schema.json",
  "id": "koalapet.base:canopy_guardian_animation",
  "preview": "assets/vertical_slice/enemies/canopy_guardian/preview.png",
  "portrait": "assets/vertical_slice/enemies/canopy_guardian/portrait.png",
  "world_animations": {
    "idle": {
      "asset": "assets/vertical_slice/enemies/canopy_guardian/idle.png",
      "frames": 2,
      "fps": 3,
      "loop": true,
      "frame_size": [
        128,
        128
      ],
      "pivot": [
        64,
        116
      ],
      "ground_anchor": [
        64,
        116
      ],
      "visual_center": [
        64,
        68
      ],
      "interaction_bounds": [
        14,
        12,
        100,
        108
      ],
      "effect_bounds": [
        0,
        0,
        128,
        128
      ],
      "mirroring_allowed": true,
      "event_markers": [],
      "source_brief": "Provisional idle presentation pose",
      "provenance": "art_source/provenance/visual-rebuild.json",
      "review_status": "PROVISIONAL_REVIEWED"
    },
    "attack": {
      "asset": "assets/vertical_slice/enemies/canopy_guardian/attack.png",
      "frames": 2,
      "fps": 10,
      "loop": false,
      "frame_size": [
        128,
        128
      ],
      "pivot": [
        64,
        116
      ],
      "ground_anchor": [
        64,
        116
      ],
      "visual_center": [
        64,
        68
      ],
      "interaction_bounds": [
        14,
        12,
        100,
        108
      ],
      "effect_bounds": [
        0,
        0,
        128,
        128
      ],
      "mirroring_allowed": true,
      "event_markers": [
        {
          "frame": 1,
          "event": "attack"
        }
      ],
      "source_brief": "Provisional attack presentation pose",
      "provenance": "art_source/provenance/visual-rebuild.json",
      "review_status": "PROVISIONAL_REVIEWED"
    },
    "hit": {
      "asset": "assets/vertical_slice/enemies/canopy_guardian/hit.png",
      "frames": 2,
      "fps": 10,
      "loop": false,
      "frame_size": [
        128,
        128
      ],
      "pivot": [
        64,
        116
      ],
      "ground_anchor": [
        64,
        116
      ],
      "visual_center": [
        64,
        68
      ],
      "interaction_bounds": [
        14,
        12,
        100,
        108
      ],
      "effect_bounds": [
        0,
        0,
        128,
        128
      ],
      "mirroring_allowed": true,
      "event_markers": [
        {
          "frame": 1,
          "event": "hit"
        }
      ],
      "source_brief": "Provisional hit presentation pose",
      "provenance": "art_source/provenance/visual-rebuild.json",
      "review_status": "PROVISIONAL_REVIEWED"
    },
    "defeat": {
      "asset": "assets/vertical_slice/enemies/canopy_guardian/defeat.png",
      "frames": 2,
      "fps": 8,
      "loop": false,
      "frame_size": [
        128,
        128
      ],
      "pivot": [
        64,
        116
      ],
      "ground_anchor": [
        64,
        116
      ],
      "visual_center": [
        64,
        68
      ],
      "interaction_bounds": [
        14,
        12,
        100,
        108
      ],
      "effect_bounds": [
        0,
        0,
        128,
        128
      ],
      "mirroring_allowed": true,
      "event_markers": [
        {
          "frame": 1,
          "event": "defeat"
        }
      ],
      "source_brief": "Provisional defeat presentation pose",
      "provenance": "art_source/provenance/visual-rebuild.json",
      "review_status": "PROVISIONAL_REVIEWED"
    },
    "victory": {
      "asset": "assets/vertical_slice/enemies/canopy_guardian/victory.png",
      "frames": 2,
      "fps": 6,
      "loop": true,
      "frame_size": [
        128,
        128
      ],
      "pivot": [
        64,
        116
      ],
      "ground_anchor": [
        64,
        116
      ],
      "visual_center": [
        64,
        68
      ],
      "interaction_bounds": [
        14,
        12,
        100,
        108
      ],
      "effect_bounds": [
        0,
        0,
        128,
        128
      ],
      "mirroring_allowed": true,
      "event_markers": [],
      "source_brief": "Provisional victory presentation pose",
      "provenance": "art_source/provenance/visual-rebuild.json",
      "review_status": "PROVISIONAL_REVIEWED"
    },
    "injured": {
      "asset": "assets/vertical_slice/enemies/canopy_guardian/injured.png",
      "frames": 2,
      "fps": 2,
      "loop": true,
      "frame_size": [
        128,
        128
      ],
      "pivot": [
        64,
        116
      ],
      "ground_anchor": [
        64,
        116
      ],
      "visual_center": [
        64,
        68
      ],
      "interaction_bounds": [
        14,
        12,
        100,
        108
      ],
      "effect_bounds": [
        0,
        0,
        128,
        128
      ],
      "mirroring_allowed": true,
      "event_markers": [],
      "source_brief": "Provisional injured presentation pose",
      "provenance": "art_source/provenance/visual-rebuild.json",
      "review_status": "PROVISIONAL_REVIEWED"
    }
  }
}
