{
  "$schema": "../../../../schemas/animation-profile.schema.json",
  "id": "koalapet.base:creekling_animation",
  "preview": "assets/vertical_slice/enemies/creekling/preview.png",
  "portrait": "assets/vertical_slice/enemies/creekling/portrait.png",
  "world_animations": {
    "idle": {
      "asset": "assets/vertical_slice/enemies/creekling/idle.png",
      "frames": 4,
      "fps": 4,
      "loop": true,
      "frame_size": [
        128,
        128
      ],
      "pivot": [
        64,
        116
      ],
      "ground_anchor": [
        64,
        116
      ],
      "visual_center": [
        64,
        68
      ],
      "interaction_bounds": [
        14,
        12,
        100,
        104
      ],
      "effect_bounds": [
        0,
        0,
        128,
        128
      ],
      "mirroring_allowed": true,
      "event_markers": [],
      "source_brief": "Sequential form-specific living animation with articulated anticipation, contact and recovery",
      "provenance": "art_source/provenance/living-animation.json",
      "review_status": "PROVISIONAL_REVIEWED"
    },
    "attack": {
      "asset": "assets/vertical_slice/enemies/creekling/attack.png",
      "frames": 8,
      "fps": 10,
      "loop": false,
      "frame_size": [
        128,
        128
      ],
      "pivot": [
        64,
        116
      ],
      "ground_anchor": [
        64,
        116
      ],
      "visual_center": [
        64,
        68
      ],
      "interaction_bounds": [
        14,
        12,
        100,
        104
      ],
      "effect_bounds": [
        0,
        0,
        128,
        128
      ],
      "mirroring_allowed": true,
      "event_markers": [
        {
          "frame": 0,
          "event": "windup_started"
        },
        {
          "frame": 3,
          "event": "projectile_release"
        },
        {
          "frame": 4,
          "event": "impact"
        },
        {
          "frame": 5,
          "event": "hit_stop"
        },
        {
          "frame": 6,
          "event": "recovery_started"
        },
        {
          "frame": 7,
          "event": "animation_complete"
        }
      ],
      "source_brief": "Sequential form-specific living animation with articulated anticipation, contact and recovery",
      "provenance": "art_source/provenance/living-animation.json",
      "review_status": "PROVISIONAL_REVIEWED"
    },
    "hit": {
      "asset": "assets/vertical_slice/enemies/creekling/hit.png",
      "frames": 6,
      "fps": 10,
      "loop": false,
      "frame_size": [
        128,
        128
      ],
      "pivot": [
        64,
        116
      ],
      "ground_anchor": [
        64,
        116
      ],
      "visual_center": [
        64,
        68
      ],
      "interaction_bounds": [
        14,
        12,
        100,
        104
      ],
      "effect_bounds": [
        0,
        0,
        128,
        128
      ],
      "mirroring_allowed": true,
      "event_markers": [
        {
          "frame": 1,
          "event": "impact"
        },
        {
          "frame": 2,
          "event": "hit_stop"
        },
        {
          "frame": 4,
          "event": "recovery_started"
        },
        {
          "frame": 5,
          "event": "animation_complete"
        }
      ],
      "source_brief": "Sequential form-specific living animation with articulated anticipation, contact and recovery",
      "provenance": "art_source/provenance/living-animation.json",
      "review_status": "PROVISIONAL_REVIEWED"
    },
    "dodge": {
      "asset": "assets/vertical_slice/enemies/creekling/dodge.png",
      "frames": 6,
      "fps": 10,
      "loop": false,
      "frame_size": [
        128,
        128
      ],
      "pivot": [
        64,
        116
      ],
      "ground_anchor": [
        64,
        116
      ],
      "visual_center": [
        64,
        68
      ],
      "interaction_bounds": [
        14,
        12,
        100,
        104
      ],
      "effect_bounds": [
        0,
        0,
        128,
        128
      ],
      "mirroring_allowed": true,
      "event_markers": [
        {
          "frame": 0,
          "event": "windup_started"
        },
        {
          "frame": 2,
          "event": "evade_started"
        },
        {
          "frame": 4,
          "event": "recovery_started"
        },
        {
          "frame": 5,
          "event": "animation_complete"
        }
      ],
      "source_brief": "Sequential form-specific living animation with articulated anticipation, contact and recovery",
      "provenance": "art_source/provenance/living-animation.json",
      "review_status": "PROVISIONAL_REVIEWED"
    },
    "defeat": {
      "asset": "assets/vertical_slice/enemies/creekling/defeat.png",
      "frames": 8,
      "fps": 7,
      "loop": false,
      "frame_size": [
        128,
        128
      ],
      "pivot": [
        64,
        116
      ],
      "ground_anchor": [
        64,
        116
      ],
      "visual_center": [
        64,
        68
      ],
      "interaction_bounds": [
        14,
        12,
        100,
        104
      ],
      "effect_bounds": [
        0,
        0,
        128,
        128
      ],
      "mirroring_allowed": true,
      "event_markers": [
        {
          "frame": 1,
          "event": "impact"
        },
        {
          "frame": 4,
          "event": "collapse_complete"
        },
        {
          "frame": 7,
          "event": "animation_complete"
        }
      ],
      "source_brief": "Sequential form-specific living animation with articulated anticipation, contact and recovery",
      "provenance": "art_source/provenance/living-animation.json",
      "review_status": "PROVISIONAL_REVIEWED"
    }
  }
}
