{"$schema":"../../../../schemas/animation-profile.schema.json","id":"koalapet.base:ember_dawn_animation","preview":"assets/vertical_slice/juveniles/ember_dawn/preview.png","portrait":"assets/vertical_slice/juveniles/ember_dawn/portrait.png","world_animations":{"idle":{"asset":"assets/vertical_slice/juveniles/ember_dawn/idle.png","frames":1,"fps":2},"attack":{"asset":"assets/vertical_slice/juveniles/ember_dawn/attack.png","frames":1,"fps":5},"hit":{"asset":"assets/vertical_slice/juveniles/ember_dawn/hit.png","frames":1,"fps":5},"victory":{"asset":"assets/vertical_slice/juveniles/ember_dawn/victory.png","frames":1,"fps":4},"injured":{"asset":"assets/vertical_slice/juveniles/ember_dawn/injured.png","frames":1,"fps":2}}}
