{
  "$schema": "../../../../schemas/animation-profile.schema.json",
  "id": "koalapet.base:egg_ember_animation",
  "preview": "assets/vertical_slice/eggs/ember/preview.png",
  "portrait": "assets/vertical_slice/eggs/ember/preview.png",
  "world_animations": {
    "idle": {
      "asset": "assets/vertical_slice/eggs/ember/idle.png",
      "frames": 2,
      "fps": 3,
      "loop": true,
      "frame_size": [
        128,
        128
      ],
      "pivot": [
        64,
        116
      ],
      "ground_anchor": [
        64,
        116
      ],
      "visual_center": [
        64,
        68
      ],
      "interaction_bounds": [
        14,
        12,
        100,
        108
      ],
      "effect_bounds": [
        0,
        0,
        128,
        128
      ],
      "mirroring_allowed": true,
      "event_markers": [],
      "source_brief": "Provisional idle presentation pose",
      "provenance": "art_source/provenance/visual-rebuild.json",
      "review_status": "PROVISIONAL_REVIEWED"
    },
    "hatch": {
      "asset": "assets/vertical_slice/eggs/ember/hatch.png",
      "frames": 2,
      "fps": 10,
      "loop": false,
      "frame_size": [
        128,
        128
      ],
      "pivot": [
        64,
        116
      ],
      "ground_anchor": [
        64,
        116
      ],
      "visual_center": [
        64,
        68
      ],
      "interaction_bounds": [
        14,
        12,
        100,
        108
      ],
      "effect_bounds": [
        0,
        0,
        128,
        128
      ],
      "mirroring_allowed": true,
      "event_markers": [
        {
          "frame": 1,
          "event": "hatch"
        }
      ],
      "source_brief": "Provisional hatch presentation pose",
      "provenance": "art_source/provenance/visual-rebuild.json",
      "review_status": "PROVISIONAL_REVIEWED"
    },
    "world": {
      "asset": "assets/vertical_slice/eggs/ember/world.png",
      "frames": 2,
      "fps": 10,
      "loop": true,
      "frame_size": [
        128,
        128
      ],
      "pivot": [
        64,
        116
      ],
      "ground_anchor": [
        64,
        116
      ],
      "visual_center": [
        64,
        68
      ],
      "interaction_bounds": [
        14,
        12,
        100,
        108
      ],
      "effect_bounds": [
        0,
        0,
        128,
        128
      ],
      "mirroring_allowed": true,
      "event_markers": [
        {
          "frame": 0,
          "event": "foot_contact"
        },
        {
          "frame": 4,
          "event": "opposite_foot_contact"
        }
      ],
      "source_brief": "Sequential in-place locomotion",
      "provenance": "art_source/provenance/visual-rebuild.json",
      "review_status": "PROVISIONAL_REVIEWED"
    }
  }
}
